{
  "schemaVersion": "2.0",
  "planId": "plan-41",
  "checkpointId": "cp_01J9K4",
  "subject": {
    "ref": "agent:support/support-triage",
    "version": "git:3f2a1c",
    "endpoint": "http://localhost:5080/v1"
  },
  "suites": [
    {
      "ref": "suite:support/triage-scenarios",
      "version": "4",
      "lane": "quality"
    },
    {
      "ref": "suite:owasp/llm-top10",
      "version": "2026.1",
      "lane": "security"
    }
  ],
  "limits": {
    "maxUsd": 3.0,
    "cases": 200,
    "timeout": "PT2H"
  },
  "contentPolicy": "off",
  "isolation": "remote-zone",
  "provider": "k8s",
  "judges": [
    {
      "model": "gpt-5.1",
      "provider": "azure.ai.openai",
      "rubricDigest": "sha256:a9a9a9a9a9a9a9a9a9a9a9a9a9a9a9a9a9a9a9a9a9a9a9a9a9a9a9a9a9a9a9a9"
    }
  ],
  "baseline": {
    "policy": "latest-sealed-on-main"
  },
  "comparability": {
    "required": [
      "judge.modelId",
      "judge.rubricDigest"
    ]
  },
  "credentialRefs": [
    {
      "name": "AZURE_OPENAI_API_KEY",
      "scheme": "env",
      "path": "AZURE_OPENAI_API_KEY",
      "purpose": "judge"
    },
    {
      "name": "SUPPORT_API_KEY",
      "scheme": "keychain",
      "path": "agenteval/support-dev",
      "purpose": "subject"
    }
  ],
  "runnerSelector": [
    "os:linux"
  ],
  "zone": "eu-1"
}
